filepath,title
/home/lee/PycharmProjects/stageCLIP/universal-image-restoration/datasets/universal/train/hazy_stage/197/1.png,"The image depicts a cityscape with several tall residential buildings. The buildings are multi-storied, with a mix of white and red-brick facades. The sky is clear and blue, indicating a sunny day. There are trees in the foreground, partially obscuring the lower buildings. The overall scene appears to be a typical urban environment."
/home/lee/PycharmProjects/stageCLIP/universal-image-restoration/datasets/universal/train/hazy_stage/197/2.png,"The image depicts a cityscape with several high-rise buildings. The buildings are primarily residential, characterized by their rectangular windows and structured facades. The sky is clear and blue, indicating a sunny day. There are also some trees or greenery visible at the bottom of the image, suggesting a landscaped area or park. The overall scene appears to be urban and well-maintained."
/home/lee/PycharmProjects/stageCLIP/universal-image-restoration/datasets/universal/train/hazy_stage/197/3.png,"The image appears to depict a cityscape with tall buildings, likely residential or commercial structures, under a clear blue sky. The buildings are partially visible, with some windows and architectural details discernible. The scene is filled with numerous small, colorful dots, which may be due to a specific visual effect or noise added to the image. The overall composition suggests an urban environment, possibly taken from a street or a lower-level view of the city."
/home/lee/PycharmProjects/stageCLIP/universal-image-restoration/datasets/universal/train/hazy_stage/198/0.png,"The image depicts an urban scene with a multi-story elevated highway or overpass. Several vehicles, including yellow taxis and a white van, are visible on the road below the overpass. The overpass is supported by large concrete pillars, and there are road signs indicating directions and restrictions. In the background, there are tall buildings, one of which has a visible sign that reads ""中国工商银行."" The sky appears overcast, suggesting cloudy weather. The area seems to be a busy urban environment with a mix of transportation and infrastructure."
/home/lee/PycharmProjects/stageCLIP/universal-image-restoration/datasets/universal/train/hazy_stage/198/1.png,"The image depicts an urban scene with a multi-story building in the background, likely an office or residential structure. The building is tall and modern, with a grid-like facade. In the foreground, there is a road with several vehicles, including a white van, a yellow taxi, and a black car. The road appears to be elevated, with a large overpass or bridge running above it. The sky is overcast, suggesting a cloudy or foggy day. There are also streetlights and traffic signs visible, indicating a busy urban environment."
/home/lee/PycharmProjects/stageCLIP/universal-image-restoration/datasets/universal/train/hazy_stage/198/2.png,"The image depicts a cityscape with a high-rise building in the background and a lower-level structure, possibly an overpass or elevated roadway, in the foreground. There are several vehicles parked along the road, including a white van and a few other cars. The overall scene appears to be urban, with the focus on the infrastructure and the vehicles. The image is somewhat grainy and has a speckled appearance, which may be due to the camera's resolution or the image being captured in low light conditions."
/home/lee/PycharmProjects/stageCLIP/universal-image-restoration/datasets/universal/train/hazy_stage/198/3.png,"The image appears to depict a scene with a structure that looks like a bridge or an overpass, with a series of vertical lines or columns visible in the background. The foreground is dark, possibly indicating a shadowed area or a lack of light. The overall color scheme is muted, with shades of gray and blue dominating the scene. The image is highly pixelated, with numerous small colored dots scattered throughout, giving it a speckled appearance."
/home/lee/PycharmProjects/stageCLIP/universal-image-restoration/datasets/universal/train/hazy_stage/199/0.png,"The image depicts a busy urban street scene under a clear blue sky. On the left side, there is a large bus with several passengers visible through its windows. The bus is parked or moving slowly among other vehicles, including a red car directly in front of it and a black car to the right. The street is lined with lush green trees, providing a canopy of foliage and creating a sense of a well-maintained urban environment. The license plate on the black car reads ""粤J F0372,"" indicating that the location might be in Guangdong Province, China. The overall atmosphere suggests a typical day in a bustling city with moderate traffic."
/home/lee/PycharmProjects/stageCLIP/universal-image-restoration/datasets/universal/train/hazy_stage/199/1.png,"The image depicts a street scene with several cars parked along the sides. There are trees lining the street, and the sky is clear with a bright blue color. The overall environment appears to be urban, with a mix of greenery and infrastructure. The image is taken from a perspective that captures the street and the surrounding area, providing a view of the parked vehicles and the natural landscape."
/home/lee/PycharmProjects/stageCLIP/universal-image-restoration/datasets/universal/train/hazy_stage/199/2.png,"The image depicts a natural outdoor scene with a clear view of a sky above, surrounded by lush green trees on both sides. The sky is a bright blue, indicating a clear day. The trees are dense and appear to be part of a forest or a heavily vegetated area. There are no visible structures or objects, suggesting a focus on the natural landscape. The overall atmosphere is serene and peaceful, with the greenery dominating the scene."
/home/lee/PycharmProjects/stageCLIP/universal-image-restoration/datasets/universal/train/hazy_stage/199/3.png,"The image appears to depict a natural landscape, possibly a forest or wooded area. The scene is filled with numerous small, colorful dots scattered throughout, giving it a speckled effect. The background features a mix of green foliage, suggesting trees or plants, and a bright blue sky above. The overall composition suggests a serene outdoor environment, with the natural elements dominating the visual field."
/home/lee/PycharmProjects/stageCLIP/universal-image-restoration/datasets/universal/train/hazy_stage/200/0.png,"The image depicts a rainy urban street scene. On the right side, there is a sidewalk with a person walking under an umbrella, wearing a dark coat and carrying a bag. The sidewalk is lined with parked cars, including a blue car in the foreground. To the left, there are more parked cars and a tall building in the background. The street is wet, indicating recent or ongoing rain. There are also several power lines visible above the street, and a few trees can be seen in the distance. On the right side of the image, there is a building with a sign in Chinese characters, suggesting that the location might be in a Chinese-speaking region. The overall atmosphere is overcast and damp, typical of a rainy day."
/home/lee/PycharmProjects/stageCLIP/universal-image-restoration/datasets/universal/train/hazy_stage/200/1.png,"The image depicts a street scene in an urban environment. There are several cars parked along the side of the road, with a few visible in the foreground. A person holding an umbrella is walking on the sidewalk, suggesting it might be raining. The background features tall buildings, likely residential or commercial, and there are trees lining the street. The overall atmosphere appears to be overcast, contributing to the rainy ambiance."
/home/lee/PycharmProjects/stageCLIP/universal-image-restoration/datasets/universal/train/hazy_stage/200/2.png,"The image depicts a street scene with several parked cars on both sides. The perspective suggests a narrow alley or a side street, with buildings lining the sides. The background includes a tall structure, possibly a building or a skyscraper, partially obscured by the perspective. The overall atmosphere appears to be urban, with a focus on the street and surrounding structures. The image is characterized by a speckled, low-resolution quality, which may be due to the nature of the image capture or the application of a specific effect."
/home/lee/PycharmProjects/stageCLIP/universal-image-restoration/datasets/universal/train/hazy_stage/200/3.png,"The image appears to depict a natural outdoor scene, possibly a park or a wooded area. There are trees in the background, and the ground seems to be covered with a layer of leaves or grass. The overall scene is somewhat obscured by a dense scattering of small, colorful dots, which could be due to a specific effect or filter applied to the image. The image is not clear enough to discern specific details or objects, but it gives an impression of a natural environment."
/home/lee/PycharmProjects/stageCLIP/universal-image-restoration/datasets/universal/train/hazy_stage/201/0.png,"The image depicts a city street scene with modern high-rise buildings in the background. The street is divided into multiple lanes, with cars parked along the sides. There are also barriers on the left side of the road, possibly for construction or maintenance purposes. The buildings are tall and varied in design, with one particularly prominent structure featuring a reflective glass facade. There are also colorful banners or advertisements visible in the distance, and a billboard with red characters. The overall atmosphere appears to be urban and busy."
/home/lee/PycharmProjects/stageCLIP/universal-image-restoration/datasets/universal/train/hazy_stage/201/1.png,"The image depicts an urban street scene with tall buildings in the background. The street is wide and appears to be a major thoroughfare, with vehicles, including cars and trucks, traveling in both directions. There are barriers on the right side of the road, and a few pedestrians can be seen walking. The sky is overcast, and the overall lighting is diffused, suggesting a cloudy day. The buildings are modern, with one particularly tall structure dominating the skyline. There are also some signs and billboards visible in the distance, but they are not clearly legible."
/home/lee/PycharmProjects/stageCLIP/universal-image-restoration/datasets/universal/train/hazy_stage/201/2.png,"The image depicts a cityscape with several tall buildings, likely skyscrapers, in the background. The buildings are modern and have a sleek design, with one of them appearing particularly prominent. The road in the foreground is wide and appears to be a major thoroughfare, with vehicles, including cars and trucks, traveling along it. The sky is overcast, giving the scene a somewhat gloomy or cloudy atmosphere. The overall setting suggests an urban environment, possibly a business district or a major city."
/home/lee/PycharmProjects/stageCLIP/universal-image-restoration/datasets/universal/train/hazy_stage/201/3.png,"The image depicts a cityscape with several tall buildings, likely skyscrapers, in the background. The buildings appear to be modern and are partially obscured by a dense array of colorful speckles, which may be due to a specific visual effect or filter applied to the image. The foreground seems to show a road or pathway, possibly a highway or a large parking lot, with vehicles faintly visible. The overall scene gives an impression of a bustling urban environment, with the buildings dominating the skyline."
/home/lee/PycharmProjects/stageCLIP/universal-image-restoration/datasets/universal/train/hazy_stage/202/0.png,"The image depicts a foggy urban scene with several buildings visible in the foreground and background. The buildings appear to be residential or commercial structures, with one prominent tall building on the right side. The area is surrounded by a mix of greenery and industrial-looking structures, with a long, straight road or canal running through the middle. The overall atmosphere is misty, obscuring some details in the distance."
/home/lee/PycharmProjects/stageCLIP/universal-image-restoration/datasets/universal/train/hazy_stage/202/1.png,"The image depicts a cityscape with a view of a train track running through the middle. On either side of the track, there are buildings, some of which appear to be residential or commercial structures. The overall atmosphere is hazy, likely due to fog or pollution, which obscures the distant background. The sky is overcast, and the visibility is low, making the details of the buildings and the track less distinct. The scene conveys a sense of urban density and possibly a polluted environment."
/home/lee/PycharmProjects/stageCLIP/universal-image-restoration/datasets/universal/train/hazy_stage/202/2.png,"The image shows a view of an urban area with a train track running through it. On the right side, there is a tall building, and the left side appears to be a mix of greenery and more structures, possibly part of the cityscape. The overall scene is somewhat hazy, suggesting it might be foggy or polluted. The image is composed of numerous small, colored dots, which are likely due to the speckled effect caused by the camera's lens or the image processing."
/home/lee/PycharmProjects/stageCLIP/universal-image-restoration/datasets/universal/train/hazy_stage/202/3.png,"The image appears to depict a natural outdoor scene, possibly a landscape or a body of water. The background is filled with numerous small, colorful dots, giving the impression of a textured or speckled surface. The colors are varied, including shades of blue, green, and red, which may suggest vegetation or water reflections. There is a faint, diagonal line cutting through the scene, which could be a pathway or part of a structure, such as a bridge or a fence. The overall impression is that of a dynamic and vibrant natural environment."
/home/lee/PycharmProjects/stageCLIP/universal-image-restoration/datasets/universal/train/hazy_stage/203/0.png,"The image depicts a serene and picturesque scene of traditional Chinese architecture. In the foreground, there is a calm body of water reflecting the structures and trees. On the left side, there is a small pavilion with a tiled roof, painted in red and surrounded by stone walls. To the right, there is a large stone wall with a tiered, multi-tiered pagoda-like structure on top, featuring intricate wooden carvings and a sloping, curved roof. The wall is flanked by lush green trees, and the sky above is clear with a few scattered clouds, creating a peaceful and harmonious atmosphere."
/home/lee/PycharmProjects/stageCLIP/universal-image-restoration/datasets/universal/train/hazy_stage/203/1.png,"The image depicts a traditional Chinese architectural structure, likely a historical or cultural landmark, situated by a body of water. The structure features a multi-tiered, pagoda-like roof with intricate designs, surrounded by lush greenery, including trees and shrubs. The water reflects the structure, creating a serene and picturesque scene. The sky above is clear with a few clouds, contributing to the tranquil atmosphere. The overall setting suggests a peaceful and culturally significant location."
/home/lee/PycharmProjects/stageCLIP/universal-image-restoration/datasets/universal/train/hazy_stage/203/2.png,"The image depicts a traditional architectural structure, likely a temple or historical building, set against a clear blue sky. The building features a prominent, tiered roof with intricate designs, possibly indicative of East Asian architecture. In the foreground, there is a reflective body of water, which mirrors the structure and surrounding elements. The scene appears serene, with a few people visible near the water, suggesting a peaceful environment. The overall atmosphere is calm and picturesque, with the structure standing as a central focal point amidst the natural surroundings."
/home/lee/PycharmProjects/stageCLIP/universal-image-restoration/datasets/universal/train/hazy_stage/203/3.png,"The image appears to depict a natural outdoor scene with a structure in the background, possibly a building or a monument. The structure is surrounded by a landscape that includes trees and a body of water, which reflects the sky and surroundings. The sky is clear with a few clouds, and the overall lighting suggests it might be daytime. The image is filled with numerous small, colorful dots, giving it a speckled appearance."
/home/lee/PycharmProjects/stageCLIP/universal-image-restoration/datasets/universal/train/hazy_stage/204/0.png,"The image depicts a wide urban street with multiple lanes, flanked by tall buildings on both sides. The street is lined with lush green trees, creating a pleasant and shaded environment. Several vehicles, including buses and cars, are traveling along the road. Pedestrians can be seen walking on the sidewalks, which are well-maintained and separated from the road by a curb. The sky appears clear, suggesting good weather conditions. The overall atmosphere is calm and orderly, typical of a well-organized urban area."
/home/lee/PycharmProjects/stageCLIP/universal-image-restoration/datasets/universal/train/hazy_stage/204/1.png,"The image depicts a city street with multiple lanes of traffic. On the left side of the street, there are tall buildings, likely residential or commercial, surrounded by greenery. The right side of the street is lined with trees, providing a natural barrier. Several vehicles, including buses and cars, are visible on the road, indicating a busy urban environment. The sky appears overcast, and the overall lighting suggests it might be a cloudy day."
/home/lee/PycharmProjects/stageCLIP/universal-image-restoration/datasets/universal/train/hazy_stage/204/2.png,"The image depicts a roadway with multiple vehicles, including a bus, traveling in a line. The road is flanked by dense greenery on both sides, and there is a tall building visible on the left side of the image. The sky appears overcast, contributing to a somewhat muted and gray atmosphere. The overall scene suggests a typical urban or suburban setting with a focus on the flow of traffic."
/home/lee/PycharmProjects/stageCLIP/universal-image-restoration/datasets/universal/train/hazy_stage/204/3.png,"The image appears to depict a scene with a blurred or low-resolution quality, featuring a mix of colors and shapes that are difficult to discern. The central area seems to have a structure, possibly a building or a wall, with some details visible. The overall scene is quite abstract, with a lot of noise and unclear features."
/home/lee/PycharmProjects/stageCLIP/universal-image-restoration/datasets/universal/train/hazy_stage/205/0.png,"The image depicts a traditional Chinese architectural structure, known as the Hall of Prayer for Good Harvests, located in the Forbidden City. The building features a large, circular, tiered roof with a golden finial at its peak, surrounded by intricate, colorful patterns on the exterior walls. The structure is elevated, accessible by a wide staircase with white stone railings and ornate lion statues at the base. Numerous visitors are seen walking and gathering around the entrance, indicating that this is a popular tourist site. The sky above is clear with scattered clouds, providing a bright and pleasant backdrop to the historical architecture."
/home/lee/PycharmProjects/stageCLIP/universal-image-restoration/datasets/universal/train/hazy_stage/205/1.png,"The image depicts a traditional East Asian architectural structure, likely a pagoda, set against a bright blue sky with scattered clouds. The building features a distinctive curved, upturned roof with a finial at its peak, characteristic of classical East Asian architecture. The structure appears to be made of wood, with intricate details visible on the lower part of the building. The surrounding area includes steps leading up to the structure, and there are some trees or vegetation visible in the lower part of the image. The overall scene suggests a serene and historical setting."
/home/lee/PycharmProjects/stageCLIP/universal-image-restoration/datasets/universal/train/hazy_stage/205/2.png,"The image depicts a traditional architectural structure, likely a pagoda, set against a bright blue sky with scattered clouds. The structure has a distinctively curved roof with a pointed apex, characteristic of East Asian architecture. The surrounding area appears to be a natural environment, possibly a park or garden, with greenery visible at the bottom of the image. The overall scene is vibrant and well-lit, suggesting a clear day."
/home/lee/PycharmProjects/stageCLIP/universal-image-restoration/datasets/universal/train/hazy_stage/205/3.png,"The image depicts a traditional architectural structure, likely a pagoda, set against a cloudy sky. The structure is silhouetted, making it difficult to discern fine details, but its shape is clearly visible. The background consists of a mix of blue and white, suggesting a sky with clouds. The overall scene appears to be a serene and possibly historical or cultural setting."
/home/lee/PycharmProjects/stageCLIP/universal-image-restoration/datasets/universal/train/hazy_stage/206/0.png,"The image depicts a cityscape with a view of a busy urban area. In the foreground, there are green trees and a parking lot with several cars. A multi-lane highway runs parallel to the area, with vehicles moving in both directions. The background features a variety of tall buildings, including skyscrapers and office complexes, with some displaying illuminated signs. The sky appears overcast, giving the scene a slightly hazy appearance. The overall atmosphere suggests a bustling metropolitan environment."
/home/lee/PycharmProjects/stageCLIP/universal-image-restoration/datasets/universal/train/hazy_stage/206/1.png,"The image depicts a cityscape with several tall buildings and a network of roads. The buildings vary in height and design, with some appearing modern and others more traditional. The foreground includes a mix of greenery, likely trees and shrubs, and a few structures that seem to be part of a park or open space. The sky is overcast, giving the scene a somewhat muted and grayish tone. The overall atmosphere appears to be urban and somewhat hazy, possibly due to weather conditions."
/home/lee/PycharmProjects/stageCLIP/universal-image-restoration/datasets/universal/train/hazy_stage/206/2.png,"The image depicts a cityscape with several tall buildings, likely skyscrapers, in the background. The buildings are of varying heights and designs, with some appearing more modern than others. The foreground shows a darker area, possibly a park or open space, with some structures or objects that are not clearly visible due to the low resolution and speckled appearance. The overall scene has a somewhat hazy or foggy atmosphere, which might be due to weather conditions or atmospheric effects."
/home/lee/PycharmProjects/stageCLIP/universal-image-restoration/datasets/universal/train/hazy_stage/206/3.png,"The image depicts a cityscape with several tall buildings in the background, likely skyscrapers, silhouetted against a cloudy or hazy sky. The foreground appears to be a mix of urban structures, possibly roads or open spaces, but the details are obscured by the speckled, colorful dots overlaying the entire scene. The overall effect gives a sense of a digitally altered or heavily processed image, with the buildings and urban landscape appearing as if they are being viewed through a camera with a low resolution or a specific artistic effect applied."
/home/lee/PycharmProjects/stageCLIP/universal-image-restoration/datasets/universal/train/hazy_stage/207/0.png,"The image depicts a cityscape with a prominent high-rise building in the center, characterized by its modern, grid-like facade. The building is flanked by smaller structures, and the scene is set under a hazy sky, suggesting overcast weather or air pollution. In the foreground, there is an elevated highway or overpass, with vehicles traveling on it. The road is divided into multiple lanes, and there are some trees and greenery visible on the sides. A sign with a blue circle and a red slash is visible on the right side of the image, indicating a restricted area. The overall atmosphere of the scene is urban and somewhat muted due to the weather conditions."
/home/lee/PycharmProjects/stageCLIP/universal-image-restoration/datasets/universal/train/hazy_stage/207/1.png,"The image depicts a cityscape with a tall, rectangular building in the center, surrounded by other structures. The sky appears overcast, and the overall lighting is dim, suggesting it might be a cloudy day. The ground level shows a parking lot or open area with a few vehicles visible. The buildings have a grid-like pattern on their facades, and the scene has a somewhat industrial or urban feel."
/home/lee/PycharmProjects/stageCLIP/universal-image-restoration/datasets/universal/train/hazy_stage/207/2.png,"The image shows a tall building with a sign that reads ""PARKROYER"" at the top. The building appears to be a high-rise structure, and the surrounding area seems to be an urban environment. The sky is overcast, and the overall lighting is dim, suggesting it might be a cloudy day. The image is quite grainy, with numerous small colored dots scattered throughout, which could be due to a specific effect or filter applied."
