filepath,title
/home/lee/PycharmProjects/stageCLIP/universal-image-restoration/datasets/universal/train/hazy_stage/99/0.png,"The image depicts a rural or semi-rural setting with a focus on a partially constructed or abandoned building. The structure is made of red bricks and has multiple windows, some of which are missing or empty. The building is surrounded by a low brick wall, and there is a concrete pathway leading to a red gate. The pathway is flanked by a low brick wall with a decorative railing, and there are leafless trees in the foreground, suggesting a winter or early spring season. In the background, there are mountains or hills, adding to the rural atmosphere. The scene appears to be quiet and devoid of human activity."
/home/lee/PycharmProjects/stageCLIP/universal-image-restoration/datasets/universal/train/hazy_stage/99/1.png,"The image depicts a rural or semi-rural outdoor setting with a clear view of a leafless tree in the foreground, branches extending across the frame. In the background, there is a structure that appears to be a building or a house, partially obscured by the tree. The building has a sloped roof and a visible staircase on its side. The surrounding area includes a pathway or walkway made of stone or concrete, bordered by a low wall. The landscape features a mountain or hill in the distance, suggesting a mountainous or hilly region. The overall atmosphere is calm and natural, with no visible human activity."
/home/lee/PycharmProjects/stageCLIP/universal-image-restoration/datasets/universal/train/hazy_stage/99/2.png,"The image depicts a scene with a tree in the foreground, its branches extending across the frame. The tree appears to be leafless, suggesting it might be winter or early spring. In the background, there is a structure that looks like a building or a wall, partially obscured by the tree. The overall lighting suggests it is daytime, with a clear sky visible in the background. The image has a grainy texture, likely due to the speckled appearance caused by the pixelation."
/home/lee/PycharmProjects/stageCLIP/universal-image-restoration/datasets/universal/train/hazy_stage/99/3.png,"The image appears to depict a scene with a tree branch extending across the frame. The background is a mix of various colors, creating a speckled effect. The overall tone of the image is muted, with a blend of dark and light shades. The scene seems to be outdoors, possibly in a residential or urban area, but the details are obscured by the speckled and low-resolution quality of the image."
/home/lee/PycharmProjects/stageCLIP/universal-image-restoration/datasets/universal/train/hazy_stage/100/0.png,"The image depicts a cityscape with several tall buildings, likely residential or office complexes, set against a clear blue sky. The buildings have a uniform architectural style with red-tiled roofs and multiple windows. In the foreground, there is a bus parked near a small structure with a red roof, possibly a bus stop or maintenance facility. The area is surrounded by greenery, including trees and shrubs, which add a natural element to the urban environment. The overall atmosphere appears calm and orderly, with no visible human activity in the scene."
/home/lee/PycharmProjects/stageCLIP/universal-image-restoration/datasets/universal/train/hazy_stage/100/1.png,"The image shows a cityscape with several tall buildings, likely residential or office structures, set against a clear blue sky. The buildings are multi-storied and have a modern architectural design. There are trees and greenery visible in the foreground, suggesting a landscaped area or park. The overall scene appears to be taken during the daytime, with ample natural light illuminating the area."
/home/lee/PycharmProjects/stageCLIP/universal-image-restoration/datasets/universal/train/hazy_stage/100/2.png,"The image depicts a cityscape with several tall buildings, likely residential or commercial, under a clear sky. The buildings are of varying heights and designs, with some featuring multiple floors. The foreground includes a large structure, possibly a monument or a significant building, partially obscured by trees. The overall scene appears to be urban, with a focus on the architectural elements of the city."
/home/lee/PycharmProjects/stageCLIP/universal-image-restoration/datasets/universal/train/hazy_stage/100/3.png,"The image depicts a structure that appears to be a classical building, possibly a historical or architectural landmark. The building has a symmetrical design with multiple archways and a prominent central section. The structure is silhouetted against a bright sky, which is filled with numerous small, colorful dots. The overall scene is quite abstract due to the speckled effect, making it difficult to discern specific details."
/home/lee/PycharmProjects/stageCLIP/universal-image-restoration/datasets/universal/train/hazy_stage/101/0.png,"The image depicts a residential area with modern apartment buildings on both sides of a well-maintained walkway. The buildings are multi-storied, primarily constructed with brick and glass, featuring numerous windows and balconies. The walkway is lined with neatly trimmed bushes and small trees, creating a pleasant and organized environment. There are a few people visible in the distance, walking along the path. The sky above is partly cloudy, with a soft, diffused light suggesting either early morning or late afternoon. The overall atmosphere is calm and serene, typical of a suburban or urban residential community."
/home/lee/PycharmProjects/stageCLIP/universal-image-restoration/datasets/universal/train/hazy_stage/101/1.png,"The image depicts a residential area with tall apartment buildings on both sides of a narrow pathway. The buildings have multiple floors and are constructed with a mix of brick and concrete materials. The pathway is flanked by greenery, including bushes and small trees, which add a touch of nature to the urban environment. The sky above is overcast, giving the scene a somewhat gloomy or cloudy appearance. The overall atmosphere appears to be quiet and serene, with no visible human activity."
/home/lee/PycharmProjects/stageCLIP/universal-image-restoration/datasets/universal/train/hazy_stage/101/2.png,"The image depicts a street scene flanked by tall buildings on both sides. The perspective suggests a view looking down the street, with the buildings appearing to be closely aligned. The sky above is clear, with a subtle gradient from light to dark, possibly indicating a time of day with diffused lighting. The overall tone of the image is somewhat muted, with a focus on the architectural details of the buildings. The street itself is not very detailed, but it appears to be a typical urban environment."
/home/lee/PycharmProjects/stageCLIP/universal-image-restoration/datasets/universal/train/hazy_stage/101/3.png,"The image appears to depict a cityscape with tall buildings, likely skyscrapers, silhouetted against a bright sky. The buildings are dark and form a symmetrical pattern, with the sky being a light, almost white color. The overall scene is quite abstract due to the speckled and pixelated appearance, which obscures finer details. The image conveys a sense of urban environment and possibly a cloudy or overcast day."
/home/lee/PycharmProjects/stageCLIP/universal-image-restoration/datasets/universal/train/hazy_stage/102/0.png,"The image depicts a clear, sunny day on a city street. The road is wide and appears to be a multi-lane road with a pedestrian crosswalk in the foreground. On the left side, there is a metal fence running parallel to the road, and behind it, there are trees with green and yellow foliage, suggesting it might be autumn. On the right side, there are several vehicles, including a white van and a red truck, parked or moving along the road. The sky is clear and blue, and there are streetlights and power lines visible along the road. The overall atmosphere is calm and typical of a suburban or urban area."
/home/lee/PycharmProjects/stageCLIP/universal-image-restoration/datasets/universal/train/hazy_stage/102/1.png,"The image depicts a street scene under a clear blue sky. On the left side, there is a sidewalk bordered by a metal fence, and beyond the fence, there are trees and some buildings partially visible. The right side of the image shows a road with parked cars and a few traffic lights. A bird is perched on a horizontal pole extending from the right side of the image, near the top. The overall atmosphere appears to be calm and sunny, with no visible pedestrians or significant activity on the street."
/home/lee/PycharmProjects/stageCLIP/universal-image-restoration/datasets/universal/train/hazy_stage/102/2.png,"The image depicts a street scene under a clear blue sky. On the left side, there is a row of trees, possibly a park or a tree-lined street. On the right side, there are several vehicles parked along the curb, and a few streetlights are visible. The road appears to be well-maintained, with a clear division between the two sides. The overall atmosphere suggests a calm, sunny day, with no visible pedestrians or significant activity."
/home/lee/PycharmProjects/stageCLIP/universal-image-restoration/datasets/universal/train/hazy_stage/102/3.png,"The image depicts a landscape scene with a clear view of a mountain on the left side and a body of water in the foreground. The sky is visible, appearing blue with some clouds. The overall scene is well-lit, suggesting it was taken during the daytime. The image is composed of numerous small, colorful dots, which are likely due to the speckled effect caused by the pixelation."
/home/lee/PycharmProjects/stageCLIP/universal-image-restoration/datasets/universal/train/hazy_stage/103/0.png,"The image depicts a historical landmark with a prominent red wall and a traditional Chinese architectural style. The structure features a large gate with a portrait of Mao Zedong in the center, surrounded by Chinese characters. The gate is adorned with red lanterns and flags, and there is a crowd of people gathered in front of it. A statue stands to the left of the gate, and several vehicles, including a black car, are visible on the road in the foreground. The overall atmosphere suggests a busy, culturally significant location."
/home/lee/PycharmProjects/stageCLIP/universal-image-restoration/datasets/universal/train/hazy_stage/103/1.png,"The image shows a large traditional Chinese building with a red wall and a tiled roof, which appears to be a historical or significant landmark. The structure has a prominent entrance with a large portrait displayed above it. There are crowds of people gathered in front of the building, suggesting it is a popular or important site. Several vehicles, including cars, are visible on the road in front of the building, indicating that it is a busy area. The overall atmosphere appears to be that of a public space, possibly a tourist attraction or a cultural site."
/home/lee/PycharmProjects/stageCLIP/universal-image-restoration/datasets/universal/train/hazy_stage/103/2.png,"The image depicts a large traditional building with a sloped roof, likely a historical or cultural structure, situated in an open area. In front of the building, there is a statue on a pedestal, and a few vehicles are parked nearby. The sky appears overcast, and the overall scene has a muted, grayish tone. The image lacks clear details due to the speckled and pixelated appearance, which may be due to a specific effect or filter applied."
/home/lee/PycharmProjects/stageCLIP/universal-image-restoration/datasets/universal/train/hazy_stage/103/3.png,"The image appears to show a blurred or low-resolution scene with a structure that resembles a building or a house in the background. The foreground is filled with numerous small, colorful dots, which may be due to a speckled effect or noise. The overall scene is quite indistinct, making it difficult to discern specific details."
/home/lee/PycharmProjects/stageCLIP/universal-image-restoration/datasets/universal/train/hazy_stage/104/0.png,"The image depicts a large, traditional Chinese architectural complex with a prominent red and yellow roof structure in the center. Surrounding the main building are numerous smaller structures with similar architectural styles. The complex is surrounded by lush greenery, including trees and bushes, which partially obscure the view of the buildings. In the background, a cityscape with modern buildings can be seen, indicating that the complex is located in an urban area. The sky is clear and blue, suggesting a sunny day."
/home/lee/PycharmProjects/stageCLIP/universal-image-restoration/datasets/universal/train/hazy_stage/104/1.png,"The image depicts a landscape with a mix of natural and man-made elements. In the foreground, there is a grassy area with some scattered vegetation. The middle ground features a cluster of buildings with red-tiled roofs, possibly residential or agricultural structures. The background shows a more urban setting with additional buildings and structures, indicating a town or city. The sky above is clear with a gradient transitioning from a light blue at the top to a slightly darker shade, suggesting a bright, sunny day."
/home/lee/PycharmProjects/stageCLIP/universal-image-restoration/datasets/universal/train/hazy_stage/104/2.png,"The image depicts a landscape with a mix of natural and man-made elements. In the foreground, there is a dense area of greenery, possibly a forest or a heavily vegetated region. In the middle ground, there are several structures that appear to be buildings or houses, suggesting a residential area. The background shows a more open, less densely populated area, possibly a plain or a field. The sky above is clear, with a gradient transitioning from a light blue at the top to a slightly darker shade, indicating a bright, sunny day."
/home/lee/PycharmProjects/stageCLIP/universal-image-restoration/datasets/universal/train/hazy_stage/104/3.png,"The image appears to depict a landscape with a clear view of a horizon line, possibly indicating a body of water or a flat terrain. The sky above is mostly clear, with a subtle gradient transitioning from a lighter hue near the horizon to a darker shade as it ascends. The overall scene is composed of a mix of natural elements, with the horizon serving as a central focal point. The image lacks any text or distinct objects, focusing instead on the natural scenery."
/home/lee/PycharmProjects/stageCLIP/universal-image-restoration/datasets/universal/train/hazy_stage/105/0.png,"The image shows two individuals standing outdoors, seemingly observing a small structure that appears to be a birdcage or decorative display. The structure is designed with a geometric pattern and has multiple birdcages on top, each containing small birds. The surrounding environment is lush with greenery, including trees and bushes, and there is a paved pathway visible in the background. The individuals are dressed casually, and the setting appears to be a park or garden area."
/home/lee/PycharmProjects/stageCLIP/universal-image-restoration/datasets/universal/train/hazy_stage/105/1.png,"The image shows two individuals standing outdoors near a small table with decorative patterns. On the table, there are several golden bird cages, likely containing birds. The setting appears to be a garden or park with greenery and a pathway in the background. The individuals seem to be observing or interacting with the bird cages. The overall atmosphere suggests a casual outdoor activity, possibly related to bird keeping or a demonstration."
/home/lee/PycharmProjects/stageCLIP/universal-image-restoration/datasets/universal/train/hazy_stage/105/2.png,"The image depicts an outdoor setting with a person standing near a table that has various items on it, possibly food or decorations. The person appears to be wearing a light-colored shirt and is standing next to a pathway or a garden area. The background includes greenery, such as trees or bushes, and the overall scene suggests a casual or social environment, possibly a gathering or event."
/home/lee/PycharmProjects/stageCLIP/universal-image-restoration/datasets/universal/train/hazy_stage/105/3.png,"The image appears to depict a room with a table and chairs. The table has a few items on it, possibly a laptop or a book, and the chairs are positioned around the table. The room seems to have a window or a door on the right side, allowing some light to enter. The overall setting looks like a casual indoor environment, possibly a study or a living room."
/home/lee/PycharmProjects/stageCLIP/universal-image-restoration/datasets/universal/train/hazy_stage/106/0.png,"The image depicts a city street scene with several tall residential buildings in the background, likely apartment complexes. The buildings are multi-storied and have a modern architectural design with balconies. The street is lined with trees, providing a green canopy over the road. There are multiple vehicles on the road, including a red SUV in the foreground and several cars in the background. The sky is clear and blue, indicating a sunny day. There is also a bus visible on the left side of the image, suggesting public transportation is available in this area. The overall atmosphere appears to be calm and urban."
/home/lee/PycharmProjects/stageCLIP/universal-image-restoration/datasets/universal/train/hazy_stage/106/1.png,"The image depicts a cityscape with several high-rise buildings in the background, likely residential or commercial structures. The sky is clear and blue, indicating a sunny day. In the foreground, there is a road with a few vehicles visible, and a large tree on the right side of the image. The overall scene appears to be urban and well-lit."
/home/lee/PycharmProjects/stageCLIP/universal-image-restoration/datasets/universal/train/hazy_stage/106/2.png,"The image depicts a cityscape with several buildings, including a tall structure that appears to be a high-rise building. There is a tree on the right side of the image, and the sky is clear with a blue hue. The overall scene seems to be taken during daylight, and the image is quite noisy, with numerous small colored dots scattered throughout."
/home/lee/PycharmProjects/stageCLIP/universal-image-restoration/datasets/universal/train/hazy_stage/106/3.png,"The image appears to depict a cityscape with several buildings in the background. The buildings are somewhat blurred, suggesting a low-resolution or heavily pixelated state. The scene is dominated by a mix of colors, including blue, green, and red, which are scattered throughout the image. The overall appearance is grainy and lacks clarity, making it difficult to discern specific details of the structures or landscape."
/home/lee/PycharmProjects/stageCLIP/universal-image-restoration/datasets/universal/train/hazy_stage/107/0.png,"The image depicts a bustling scene at the Tiananmen Gate, a prominent historical and cultural landmark in Beijing, China. The gate is characterized by its traditional Chinese architecture, with a large red wall and a multi-tiered, ornate roof. Red flags and lanterns are prominently displayed, adding to the traditional aesthetic. A large crowd of people is gathered in front of the gate, indicating that this is a popular tourist destination. The sky is clear, suggesting a bright and sunny day. A tall stone statue, possibly a mythical creature, is visible on the left side of the image, contributing to the historical ambiance of the location. The Chinese characters on the wall read ""中华人民共和国万岁"" (Long Live the People's Republic of China) and ""世界人民大团结万岁"" (Long Live the Great Unity of the World People)."
/home/lee/PycharmProjects/stageCLIP/universal-image-restoration/datasets/universal/train/hazy_stage/107/1.png,"The image depicts a large, traditional Chinese architectural structure with a red wall and a multi-tiered roof, which appears to be a historical or cultural landmark. The building is surrounded by a crowd of people, some of whom are dressed in traditional attire. There is a tall column to the left of the building, and several flags are visible on the roof. The scene seems to be a public event or gathering, possibly a festival or celebration. The sky is overcast, and the overall atmosphere appears lively and vibrant."
/home/lee/PycharmProjects/stageCLIP/universal-image-restoration/datasets/universal/train/hazy_stage/107/2.png,"The image depicts a large, traditional Chinese architectural structure, likely a historical or significant building, with a red wall and a multi-tiered roof. The structure is adorned with red flags and has a prominent entrance. In the foreground, there is a tall column with a statue on top, and a crowd of people gathered in front of the building. The overall scene appears to be a public or ceremonial event, with the building possibly being a landmark or a place of importance."
/home/lee/PycharmProjects/stageCLIP/universal-image-restoration/datasets/universal/train/hazy_stage/107/3.png,"The image appears to show a blurred and pixelated scene, possibly of a landscape or architectural structure. The details are not clear due to the pixelation, but it seems to include a building with a sloped roof, possibly a traditional structure, and a tall, slender object on the left side. The overall color scheme is muted, with shades of green, blue, and red, which might suggest a natural environment or a specific cultural setting."
/home/lee/PycharmProjects/stageCLIP/universal-image-restoration/datasets/universal/train/hazy_stage/108/0.png,"The image depicts a serene scene of a traditional Chinese architectural structure, likely a historical or cultural landmark, situated along a calm body of water. The building features a multi-tiered, ornate roof with upturned eaves, characteristic of traditional Chinese architecture. The structure is surrounded by lush greenery, including trees and shrubs, which frame the scene. The water reflects the building and the sky, creating a mirror-like effect. The sky is partly cloudy, with a soft, warm glow suggesting either sunrise or sunset, casting a gentle light over the entire scene. The overall atmosphere is peaceful and tranquil, emphasizing the harmony between nature and architecture."
/home/lee/PycharmProjects/stageCLIP/universal-image-restoration/datasets/universal/train/hazy_stage/108/1.png,"The image depicts a serene landscape with a traditional pagoda-style structure situated on a small hill. The structure is surrounded by trees, and there is a body of water in the foreground, reflecting the pagoda and the surrounding scenery. The sky appears to be overcast, with a soft, diffused light illuminating the scene. The overall atmosphere is calm and tranquil, with a focus on the harmonious blend of natural and architectural elements."
/home/lee/PycharmProjects/stageCLIP/universal-image-restoration/datasets/universal/train/hazy_stage/108/2.png,"The image depicts a landscape scene with a prominent tree structure in the center, likely a pagoda or similar traditional Asian architecture. The background appears to be a cloudy or overcast sky, and there are other smaller structures or trees visible in the distance. The overall scene has a muted, almost monochromatic color scheme, with the tree and sky being the most prominent features. The image is characterized by a grainy texture, suggesting it might be a low-resolution or taken with a specific camera or filter effect."
/home/lee/PycharmProjects/stageCLIP/universal-image-restoration/datasets/universal/train/hazy_stage/108/3.png,"The image appears to depict a natural landscape with a prominent tree or bush in the foreground. The background is a mix of various colors, suggesting a cloudy or overcast sky. The overall scene is quite dark, with the details of the landscape being less distinct due to the speckled and pixelated appearance."
/home/lee/PycharmProjects/stageCLIP/universal-image-restoration/datasets/universal/train/hazy_stage/109/0.png,"The image depicts an urban environment with several buildings and a parking lot. In the foreground, there is a tall, modern high-rise building with a rounded top, surrounded by smaller residential buildings. The buildings are surrounded by trees and a parking lot filled with cars. The sky appears hazy, suggesting possible air pollution or fog. The overall scene gives a sense of a typical city area with a mix of residential and commercial structures."
/home/lee/PycharmProjects/stageCLIP/universal-image-restoration/datasets/universal/train/hazy_stage/109/1.png,"The image depicts an urban environment with several buildings visible in the background. There is a tall, narrow structure on the left side, possibly a part of a building or a bridge. In the middle and right, there are multiple mid-rise buildings, likely residential or commercial structures. The sky appears overcast, and the overall lighting is dim, suggesting it might be a cloudy day. There are also some trees and parked cars visible at the bottom of the image."
/home/lee/PycharmProjects/stageCLIP/universal-image-restoration/datasets/universal/train/hazy_stage/109/2.png,"The image depicts a cityscape with several buildings, including high-rise structures. The buildings appear to be residential or commercial, with multiple floors visible. The sky is overcast, and the overall lighting is dim, suggesting it might be a cloudy day. There are no visible people or vehicles in the image, and the focus is primarily on the buildings and the sky."
