filepath,title
/home/lee/PycharmProjects/stageCLIP/universal-image-restoration/datasets/universal/train/hazy_stage/293/2.png,"The image depicts a large, colorful floral arrangement resembling a basket, situated in an open area. The basket is adorned with various flowers, creating a vibrant and lively display. In the background, there is a structure that appears to be a traditional building with a curved roof, possibly a pavilion or a historical landmark. The sky is clear and blue, providing a bright and sunny atmosphere. The foreground shows a field with a pattern of colorful flowers, likely part of a larger floral display or festival."
/home/lee/PycharmProjects/stageCLIP/universal-image-restoration/datasets/universal/train/hazy_stage/293/3.png,"The image appears to depict a scene with a large, colorful structure in the center, possibly a statue or a decorative object. The background is a mix of blue and green hues, suggesting an outdoor setting. The foreground seems to be a flat, multicolored surface, possibly a plaza or a decorative ground. The overall scene is vibrant and colorful, with a focus on the central object."
/home/lee/PycharmProjects/stageCLIP/universal-image-restoration/datasets/universal/train/hazy_stage/294/0.png,"The image depicts a cityscape with a wide view of a river running through the middle, bordered by a road on both sides. On the left side of the river, there are several multi-story buildings, some of which have distinctive architectural features like a tower with a dome-like top. The buildings are closely packed, indicating a densely populated urban area. In the background, there are numerous high-rise buildings under construction, suggesting ongoing development in the city. The sky is overcast, with a soft, diffused light illuminating the scene, giving it a somewhat muted and calm atmosphere. The trees lining the riverbanks are bare, suggesting it might be late autumn or winter. The overall scene conveys a sense of a bustling city with ongoing growth and development."
/home/lee/PycharmProjects/stageCLIP/universal-image-restoration/datasets/universal/train/hazy_stage/294/1.png,"The image depicts a cityscape with numerous high-rise buildings, likely skyscrapers, forming a dense urban environment. In the foreground, there is a water feature with multiple streams of water, possibly part of a fountain or a similar urban water feature. The overall atmosphere appears to be overcast, with a grayish sky and muted lighting, suggesting a cloudy or foggy day. The buildings are modern and varied in design, contributing to a bustling metropolitan setting."
/home/lee/PycharmProjects/stageCLIP/universal-image-restoration/datasets/universal/train/hazy_stage/294/2.png,"The image appears to depict a cityscape with several tall buildings in the background. The buildings are somewhat obscured by a layer of speckles, which may be due to a low-resolution or heavily pixelated image. The overall scene is dark, with the buildings standing out against a lighter sky. The image does not contain any visible text or distinct features that can be identified clearly."
/home/lee/PycharmProjects/stageCLIP/universal-image-restoration/datasets/universal/train/hazy_stage/294/3.png,"The image appears to depict a landscape with a faint silhouette of trees or vegetation in the foreground. The background is a mix of various colors, suggesting a cloudy or overcast sky. The overall scene is quite dark, with the details of the landscape being obscured by the diffuse lighting."
/home/lee/PycharmProjects/stageCLIP/universal-image-restoration/datasets/universal/train/hazy_stage/295/0.png,"The image depicts a bustling street scene in what appears to be a traditional Chinese city. The focal point is a decorative sign with Chinese characters, which reads ""大排面"" (Dà Pái Miàn), indicating a place where large noodles are sold. Below the sign, there are several red lanterns hanging, adding to the festive atmosphere. The street is crowded with people, some of whom are wearing winter clothing, suggesting a cold day. The architecture on either side of the street features traditional Chinese elements, such as ornate windows and decorative patterns. The overall scene conveys a lively and vibrant cultural environment."
/home/lee/PycharmProjects/stageCLIP/universal-image-restoration/datasets/universal/train/hazy_stage/295/1.png,"The image depicts a bustling street scene in what appears to be an urban area with traditional architectural elements. The buildings on either side are adorned with intricate designs, and there are red lanterns hanging in the center, suggesting a festive or cultural atmosphere. The crowd of people in the foreground indicates that this is a lively area, possibly a market or a tourist destination. The overall ambiance is vibrant and busy, with a mix of traditional and modern elements."
/home/lee/PycharmProjects/stageCLIP/universal-image-restoration/datasets/universal/train/hazy_stage/295/2.png,"The image depicts a street scene with buildings on either side. The architecture appears to be European, with narrow streets and ornate facades. There are people visible in the foreground, though they are not clearly distinguishable due to the speckled, low-resolution quality of the image. The sky is overcast, and the overall lighting is dim, suggesting it might be a cloudy day. The scene gives an impression of a busy urban area, possibly in a historic district."
/home/lee/PycharmProjects/stageCLIP/universal-image-restoration/datasets/universal/train/hazy_stage/295/3.png,"The image appears to depict a dimly lit indoor space with a focus on a window or a transparent surface on the right side. The background is filled with a multitude of small, colorful dots, giving the image a speckled effect. The colors include red, green, blue, and yellow, which are distributed unevenly across the image. The overall scene seems to be quite abstract, with the details obscured by the dense pattern of dots."
/home/lee/PycharmProjects/stageCLIP/universal-image-restoration/datasets/universal/train/hazy_stage/296/0.png,"The image depicts a cityscape with tall residential buildings in the background, likely apartment complexes, characterized by their uniform and repetitive architectural design. The buildings are light-colored, possibly white or gray, and appear to be quite high in elevation. In the foreground, there is a road with a black sedan car driving on it, and a traffic light is visible on the right side of the image. The road is divided by white lane markings, and there are some trees and greenery visible between the road and the buildings. The overall atmosphere appears to be slightly hazy, possibly due to air pollution or fog."
/home/lee/PycharmProjects/stageCLIP/universal-image-restoration/datasets/universal/train/hazy_stage/296/1.png,"The image shows a cityscape with tall residential buildings in the background, partially obscured by haze or fog. In the foreground, there is a road with a black car driving on it. The road is bordered by a metal fence, and there are trees and greenery visible behind the fence. The overall atmosphere appears to be somewhat hazy, with a muted color palette."
/home/lee/PycharmProjects/stageCLIP/universal-image-restoration/datasets/universal/train/hazy_stage/296/2.png,"The image depicts a cityscape with tall buildings in the background, partially obscured by trees. The foreground shows a road with a car parked on the right side. The overall scene appears to be urban, with a focus on the architecture and greenery."
/home/lee/PycharmProjects/stageCLIP/universal-image-restoration/datasets/universal/train/hazy_stage/296/3.png,"The image appears to depict a street scene with a blurred or low-resolution quality. The background shows a row of trees and possibly some buildings, but the details are obscured by a dense scattering of colorful dots. The overall scene lacks clarity, making it difficult to discern specific objects or features."
/home/lee/PycharmProjects/stageCLIP/universal-image-restoration/datasets/universal/train/hazy_stage/297/0.png,"The image depicts a traditional Chinese-style bridge with ornate, multi-tiered roofs and intricate green and red detailing. The bridge is constructed of stone and features a white balustrade with decorative elements. Below the bridge, a body of water is visible, with boats docked along the shore. The surrounding environment includes lush greenery, with weeping willow trees and other vegetation visible in the background. A person holding an umbrella is walking on the right side of the bridge, and the sky is clear and blue, indicating a sunny day."
/home/lee/PycharmProjects/stageCLIP/universal-image-restoration/datasets/universal/train/hazy_stage/297/1.png,"The image depicts a traditional Chinese architectural structure, specifically a bridge with ornate, multi-tiered roofs. The bridge is made of stone and features intricate designs, including decorative railings and supporting pillars. There are people walking on the bridge, some holding umbrellas, suggesting a sunny day. The bridge crosses over a body of water, and there are boats docked nearby, indicating a waterway or canal. The surrounding area includes lush greenery, with trees and plants visible in the background. The overall scene conveys a serene and historical atmosphere typical of traditional Chinese architecture."
/home/lee/PycharmProjects/stageCLIP/universal-image-restoration/datasets/universal/train/hazy_stage/297/2.png,"The image depicts a traditional Chinese architectural structure, likely a bridge or pavilion, with a multi-tiered roof featuring upturned eaves. The structure is situated over a body of water, with a stone or concrete walkway leading to it. There are people visible on the walkway, and a boat can be seen in the water near the structure. The background includes greenery, possibly trees or bushes, contributing to a serene and traditional atmosphere. The overall scene appears to be a historical or cultural site, emphasizing traditional Chinese architecture and water elements."
/home/lee/PycharmProjects/stageCLIP/universal-image-restoration/datasets/universal/train/hazy_stage/297/3.png,"The image appears to show a structure with a sloped roof, possibly a small building or a pavilion, surrounded by a garden or landscaped area. The background is filled with numerous small, colorful dots, which are likely due to the speckled effect of the image. The overall scene seems to be outdoors, and the details of the structure and surrounding area are not very clear due to the speckled effect."
/home/lee/PycharmProjects/stageCLIP/universal-image-restoration/datasets/universal/train/hazy_stage/298/0.png,"The image depicts an urban scene with a focus on a sports complex surrounded by tall buildings. The sports complex includes a green artificial turf field with white boundary lines, surrounded by a fence. In the background, there are several high-rise buildings, some of which have visible company logos, such as ""Bank of America"" and ""Bank of America Merrill Lynch."" The sky is clear and blue, indicating a sunny day. The area appears to be part of a city, with a mix of commercial and possibly residential buildings. The overall atmosphere suggests a bustling urban environment with a focus on business and recreation."
/home/lee/PycharmProjects/stageCLIP/universal-image-restoration/datasets/universal/train/hazy_stage/298/1.png,"The image depicts a cityscape with several tall buildings, including a prominent black skyscraper in the center. Surrounding the skyscraper are other high-rise structures, some with a grid-like facade. In the foreground, there is a green open field, likely a sports field or park, with trees and pathways visible. The sky is clear and blue, indicating a sunny day. The overall scene suggests an urban environment with a mix of commercial and recreational spaces."
/home/lee/PycharmProjects/stageCLIP/universal-image-restoration/datasets/universal/train/hazy_stage/298/2.png,"The image depicts a cityscape with several tall buildings, likely skyscrapers, under a clear blue sky. The buildings are modern and vary in height, with one particularly prominent structure in the center. The foreground includes a green area, possibly a park or a landscaped space, and a pathway or road leading through it. The overall scene appears to be urban and well-maintained, with no visible signs of disrepair or neglect."
/home/lee/PycharmProjects/stageCLIP/universal-image-restoration/datasets/universal/train/hazy_stage/298/3.png,"The image depicts a cityscape with several tall buildings, likely skyscrapers, in the background. The buildings appear to be modern and are silhouetted against a bright sky, suggesting it might be daytime. The foreground is less distinct, but it seems to be a paved area, possibly a street or plaza. The overall scene has a somewhat hazy or blurred effect, which might be due to atmospheric conditions or intentional artistic choice."
/home/lee/PycharmProjects/stageCLIP/universal-image-restoration/datasets/universal/train/hazy_stage/299/0.png,"The image depicts a cityscape with tall residential buildings, likely apartment complexes, painted in red and beige. These buildings are situated along a river, with a concrete embankment separating the water from the road. The road above the embankment is busy with vehicles, and there is a bridge spanning the river. The area is surrounded by lush green trees, providing a natural contrast to the urban environment. The sky appears hazy, possibly due to pollution or fog, and the overall atmosphere suggests a typical urban setting with a mix of greenery and infrastructure."
/home/lee/PycharmProjects/stageCLIP/universal-image-restoration/datasets/universal/train/hazy_stage/299/1.png,"The image depicts a cityscape with tall residential buildings on the left side, characterized by their red and brown facades. The buildings are surrounded by greenery, including trees and shrubs, which line the area. In the center, there is a body of water, likely a river or canal, with a bridge spanning across it. The bridge appears to be a concrete structure, and the water reflects the surrounding buildings and sky. The overall atmosphere of the scene is urban and somewhat hazy, possibly due to weather conditions or pollution."
/home/lee/PycharmProjects/stageCLIP/universal-image-restoration/datasets/universal/train/hazy_stage/299/2.png,"The image depicts a cityscape with tall buildings in the background, likely residential or commercial structures, and a body of water in the foreground, possibly a river or canal. There is a bridge crossing the water, and the scene appears to be overcast or cloudy, as the sky is gray and there is no direct sunlight. The image is filled with numerous small, colorful dots, which are likely a form of noise or distortion, making it difficult to discern the main subject clearly."
/home/lee/PycharmProjects/stageCLIP/universal-image-restoration/datasets/universal/train/hazy_stage/299/3.png,"The image depicts a blurred urban scene with a focus on a bridge or overpass in the center. The background features tall buildings, likely skyscrapers, and the overall scene appears to be in a city environment. The image is heavily pixelated, with numerous small colored dots scattered throughout, giving it a noisy and abstract appearance. The colors are not distinct, and the details of the structures and surroundings are obscured by the pixelation."
/home/lee/PycharmProjects/stageCLIP/universal-image-restoration/datasets/universal/train/hazy_stage/300/0.png,"The image depicts a busy urban street scene with multiple lanes of traffic. On the left side, there is a pink building with a green construction area in front of it. The right side features a mix of residential and commercial buildings, with some construction work visible. Several cars are seen driving on the road, including a white car in the foreground. The sky appears overcast, and the overall atmosphere is somewhat hazy. The road is well-marked, and there are sidewalks on both sides."
/home/lee/PycharmProjects/stageCLIP/universal-image-restoration/datasets/universal/train/hazy_stage/300/1.png,"The image depicts a city street with multiple lanes of traffic. There are several cars visible, including a white sedan in the foreground. The street is flanked by tall buildings on both sides, which appear to be residential or commercial structures. The sky is overcast, giving the scene a somewhat gloomy appearance. The road is well-marked, with clear lane divisions, and the overall atmosphere suggests a typical urban environment."
/home/lee/PycharmProjects/stageCLIP/universal-image-restoration/datasets/universal/train/hazy_stage/300/2.png,"The image depicts a street scene with buildings on both sides and a car parked on the left side of the road. The road appears to be in an urban area, with trees and possibly some greenery visible in the background. The sky is overcast, and the overall lighting is dim, suggesting it might be early morning or late afternoon. The image is filled with numerous small, colorful dots, which are likely due to the pixelation effect."
/home/lee/PycharmProjects/stageCLIP/universal-image-restoration/datasets/universal/train/hazy_stage/300/3.png,"The image appears to depict a scene with a blurred or low-resolution quality, featuring a mix of colors and shapes that are difficult to discern. The primary subject seems to be a landscape or urban area, with indistinct outlines of buildings or structures. The colors are scattered and do not form a clear, recognizable image. The overall impression is that of a scene with a lot of noise or distortion, making it challenging to identify specific details."
/home/lee/PycharmProjects/stageCLIP/universal-image-restoration/datasets/universal/train/hazy_stage/301/0.png,"The image depicts a cityscape during what appears to be early morning or late evening, as the sky is overcast and the lighting is dim. The foreground consists of residential buildings with flat roofs, some of which have rooftop equipment. In the middle ground, there is a large green area, possibly a park or a forested area, with scattered lights indicating human activity. The background showcases a dense urban skyline with numerous high-rise buildings, some of which are illuminated, suggesting that it is either dawn or dusk. The overall atmosphere is calm, with a muted color palette dominated by grays and soft blues."
/home/lee/PycharmProjects/stageCLIP/universal-image-restoration/datasets/universal/train/hazy_stage/301/1.png,"The image depicts a cityscape with a skyline in the background, characterized by numerous buildings and structures. The foreground shows a rooftop with a railing, and the overall scene appears to be taken during a cloudy or overcast day, as the sky is gray and there is a diffuse light. The buildings in the background are silhouetted against the sky, and there are some lights visible, suggesting an urban environment. The image lacks any text or specific details that would indicate a particular location or event."
/home/lee/PycharmProjects/stageCLIP/universal-image-restoration/datasets/universal/train/hazy_stage/301/2.png,"The image depicts a landscape scene with a view of a city skyline in the distance. The foreground consists of a road or pathway, and the background shows a hazy, urban area with buildings and structures. The sky appears overcast, and the overall scene has a muted, grayish tone. The image is filled with numerous small, colorful dots, which are likely due to the speckled effect caused by the camera's lens or the image processing technique."
/home/lee/PycharmProjects/stageCLIP/universal-image-restoration/datasets/universal/train/hazy_stage/301/3.png,"The image primarily consists of a blurred and pixelated scene, with a mix of colors including blue, green, red, and yellow. The overall appearance suggests a lack of clarity, making it difficult to discern specific details. The lower portion of the image appears darker, possibly indicating a shadowed area or a darker surface, while the upper portion is more uniformly lit. The image lacks distinct objects or structures, giving it a chaotic and abstract feel."
/home/lee/PycharmProjects/stageCLIP/universal-image-restoration/datasets/universal/train/hazy_stage/302/0.png,"The image depicts a stone structure with intricate carvings, likely part of an ancient or historical site. The structure consists of two large stone pillars with elaborate designs, forming an archway. The pillars are supported by smaller stone blocks arranged in a stepped manner. The surrounding area is filled with scattered stone fragments, suggesting the ruins of a larger structure. The background shows some greenery, possibly trees, and a cloudy sky, indicating an outdoor setting."
/home/lee/PycharmProjects/stageCLIP/universal-image-restoration/datasets/universal/train/hazy_stage/302/1.png,"The image depicts an ancient stone structure, likely a part of a historical or archaeological site. The structure features intricate carvings and architectural elements, including arches and decorative patterns. The stone appears weathered, suggesting it has been exposed to the elements for a long time. The background is relatively clear, with some greenery visible, indicating the structure is located in an open area. The overall scene gives an impression of historical significance and architectural craftsmanship."
/home/lee/PycharmProjects/stageCLIP/universal-image-restoration/datasets/universal/train/hazy_stage/302/2.png,"The image depicts a historical or ancient structure, likely a stone archway or entrance, surrounded by ruins. The structure appears to be made of large stone blocks, and the area is composed of steps leading up to the arch. The background is filled with a dense, speckled pattern, which is likely due to the image being heavily pixelated or distorted. The overall scene gives an impression of an archaeological site or an ancient monument."
/home/lee/PycharmProjects/stageCLIP/universal-image-restoration/datasets/universal/train/hazy_stage/302/3.png,"The image appears to depict a natural landscape with a variety of elements. The foreground shows a rocky terrain with uneven surfaces, possibly indicative of a natural or undeveloped area. In the background, there is a structure that resembles a small building or a monument, surrounded by vegetation. The overall scene is quite dense with natural features, and the image lacks clear details due to the pixelation and speckled appearance."
/home/lee/PycharmProjects/stageCLIP/universal-image-restoration/datasets/universal/train/hazy_stage/303/0.png,"The image depicts a tall, slender tower with a distinct observation deck near the top, surrounded by a clear blue sky. The tower is surrounded by a few trees, and there are vehicles parked at the base of the structure. The overall scene appears to be a clear day with no visible clouds, and the tower stands prominently in the center of the image."
/home/lee/PycharmProjects/stageCLIP/universal-image-restoration/datasets/universal/train/hazy_stage/303/1.png,"The image depicts a tall, slender tower with a spherical observation deck at the top, set against a clear blue sky. The structure appears to be a landmark or observation tower, likely situated in a park or open area with trees in the foreground. The tower is made of a light-colored material, possibly concrete or stone, and stands prominently in the center of the scene. The surrounding environment includes green trees, and there are no visible signs of human activity or other structures in the immediate vicinity."
/home/lee/PycharmProjects/stageCLIP/universal-image-restoration/datasets/universal/train/hazy_stage/303/2.png,"The image depicts a tall, slender tower with a wide observation deck at the top, set against a clear blue sky. The structure appears to be a landmark or observation tower, surrounded by trees and other vegetation. The tower is centrally positioned in the frame, with its base surrounded by greenery. The image is taken from a low angle, emphasizing the height and prominence of the tower."
/home/lee/PycharmProjects/stageCLIP/universal-image-restoration/datasets/universal/train/hazy_stage/303/3.png,"The image depicts a tall structure resembling a tower, likely a telecommunications or observation tower, set against a clear blue sky. The tower is surrounded by a dense cluster of trees, which appear as dark green silhouettes. The overall scene suggests a clear day with no visible clouds, and the tower stands prominently in the center of the frame."
/home/lee/PycharmProjects/stageCLIP/universal-image-restoration/datasets/universal/train/hazy_stage/304/0.png,"The image depicts a section of the Great Wall of China, a historic fortification built along the northern borders of China. The wall ascends a gently sloping hill, with a stone pathway leading up to a watchtower at the top. The watchtower is made of stone and has small windows, typical of traditional Chinese architecture. The surrounding area is covered with dry, leafless vegetation, suggesting a winter or early spring season. Several people are seen walking up the wall, indicating that it is a popular tourist destination. The sky above is clear and blue, providing a stark contrast to the earthy tones of the wall and vegetation."
/home/lee/PycharmProjects/stageCLIP/universal-image-restoration/datasets/universal/train/hazy_stage/304/1.png,"The image depicts a section of the Great Wall of China, a historic fortification made of stone and brick. The wall ascends steeply from the ground, leading to a watchtower at the top. The watchtower is rectangular with small windows, and there are a few people visible walking up the wall. The surrounding area is covered with dry grass and sparse vegetation, indicating a cold or dry season. The sky above is clear and blue, providing a bright backdrop to the scene."
